type,name,description
parent,CZ Benance,"As CZ steps off the blockchain ride, his exit is a masterclass in sly winks to the crypto circus. Each NFT subtly spins the carousel of crypto clichés, turning them on their head with a touch of class and a dash of sass."
backgrounds,CZ Benance Backgrounds,"CZ, our cryptic guide, takes us on a journey through memorable places that mirror the dynamic landscape of the cryptoverse. Each background offers a glimpse into the highs and lows, twists and turns of the crypto world."
glasses,CZ Benance Glasses,"Let your eyewear do the talking, whether you're mirroring the ""Pretend to be happy"" or embracing the magic of CZ. These glasses are your ticket to meme stardom. "
hands,CZ Benance Hands,"In the wild world of crypto, words can't always convey the absurdity. That's where these expressive hands come in, ready to translate memes and iconic moments into pure hilarity."
hats,CZ Benance Hats,"It's not just a hat; it's a crypto statement. From Wall Street's finest to fast food fun, these hats let you wear your financial and culinary passions on your head."
shirts,CZ Benance Shirts,"Own your style on the streets, at your job or at high status circles. Welcome to a world of playful sophistication!"
