consecutive,name,description
1,Aliens Guy Hands,"Strap in, because these hands are your intergalactic passport to meme enlightenment."
2,Bogdanoff Hands,"With these, you're the puppeteer of the crypto circus, pulling the strings of enigmatic exchanges with a twist. "
3,Four Fingers,"A silent nod to a $4.3 billion fine, these hands speak volumes in the language of finance. With this symbol, you carry a reminder of the crypto world's intricate dance with regulations and fines, all held within a simple yet profound gesture."
4,Khaby Hands,These hands are your secret weapon for navigating the universe with the same comedic finesse as the internet sensation himself.
5,Middle Finger,"These hands radiate a fearless, rebellious spirit that's impossible to ignore."
6,Prison Bars,Breakout of the ordinary and redefine the rules in your own unique way! Or not. 
7,Roll Safe Hands,Your journey just got smarter and more meme-worthy.
8,Sminem Hands,These hands are your ticket to the world of typo treasures.
9,Watchout Hands,Stay alert and keep your adventure as thrilling as a rollercoaster ride!
